sub_station,sub_address,lat,long
Miyapur,"Miyapur Metro Station, Nadigada Tanda, Miyapur, Hyderabad, Telangana",17.4964542,78.3707472
JNTU College,"JNTU College Metro Station, near JNTU College, near jntu college, Dharma Reddy Colony Phase II, Kukatpally Housing Board Colony, Kukatpally, Hyderabad, Telangana",17.4985658,78.3866769
KPHB Colony,"KPHB Colony Metro Station, Bhagya Nagar Colony, Kukatpally, Hyderabad, Telangana",17.4937967,78.3994826
Kukatpally,"Kukatpally Metro Station, APHB Colony, Kukatpally, Hyderabad, Telangana",17.4851155,78.409369
Balanagar,"Dr B.R. Ambedkar Balanagar Metro Station, IDA Kukatpally, Kukatpally, Hyderabad, Telangana",17.476826,78.4199259
Moosapet,"Moosapet Metro Station, National Highway 65, Bhavani Nagar, Moosapet, Hyderabad, Telangana",17.4720173,78.4237693
Bharat Nagar,"Bharat Nagar Metro Station, Bharat Nagar Colony, HIG Colony, Sultan Bagh, Moosapet, Hyderabad, Telangana",17.4639553,78.4278805
Erragadda Road,"Erragadda Metro Station, Prem Nagar, Sanath Nagar, Hyderabad, Telangana",17.457209,78.4313313
ESI Hospital,"ESI Hospital Metro Station, BK Guda, Erragadda, Hyderabad, Telangana",17.4474675,78.4361153
S R Nagar,"S R Nagar Metro Station, Mumbai Highway, Mothi Nagar, Sanjeeva Reddy Nagar Office Area, Sanjeeva Reddy Nagar, Hyderabad, Telangana",17.4416568,78.439444
Ameerpet,"Ameerpet Metro Station, near to Mythrivanam, Ameerpet, Hyderabad, Telangana",17.4356845,78.4424089
Punjagutta,"Punjagutta Metro Station, Punjagutta Officers Colony, Punjagutta, Hyderabad, Telangana",17.428605,78.4489723
Irrum Manzil,"Irrum Manzil Metro station, Punjagutta Road, Sangeet Nagar, Somajiguda, Hyderabad, Telangana",17.4205591,78.4539056
Khairatabad,"Khairatabad Metro Station, Khairatabad Foot Over Bridge, Indira Nagar, Khairtabad, Hyderabad, Telangana",17.4123638,78.4586074
Lakdi-Ka-Pul,"Lakdi-Ka-Pul, Ambedkar Colony, Khairtabad, Hyderabad, Telangana",17.403954,78.4628153
Assembly,Assembly hyderabad metro,17.3990799,78.4710956
Nampally,"Nampally Metro Station, National Highway 44, Red Hills, Lakdikapul, Hyderabad, Telangana",17.3923473,78.4679409
Gandhi Bhavan,"Gandhi Bhavan Metro Station, APHB Colony, Chandra Vihar, Old Kattal Mandi, Abids, Hyderabad, Telangana",17.3848433,78.4716786
Osmania Medical College,"Osmania Medical College, Jambagh Road, Troop Bazaar, Koti, Hyderabad, Telangana",17.382346,78.4788825
MG Bus Station,"MG Bus Station Metro Station, Imlibun, Gowliguda, Hyderabad, Telangana",17.379853,78.483794
Malakpet,"Malakpet Metro Rail Station, Musi Nagar, Old Malakpet, Hyderabad, Telangana",17.377281,78.4916403
New Market,"New Market Metro station, Palton, Dayanand Nagar, New Malakpet, Hyderabad, Telangana",17.3734627,78.5004312
Musarambagh,"Musarambagh, Saleem Nagar Colony, Malakpet Extension, Old Malakpet, Hyderabad, Telangana",17.371128,78.5097553
Dilsukhnagar,"Dilsukhnagar Metro Station, Mellacheruvu - Cement Factory Road, AP State Housing Board, Ravi Residency, Krishna Nagar, Dilsukhnagar, Mellacheruvu, Telangana",17.368594,78.5235413
Chaitanyapuri,"Chaitanyapuri Metro Station, Sri Sai Shivani Complex, Kamala Nagar, Hyderabad, Telangana",17.3683237,78.5337391
Victoria Memorial,"Victoria Memorial Metro Station, Dwarka Nagar, L. B. Nagar, Hyderabad, Telangana",17.3609668,78.5420416
L.B. Nagar,"L.B. Nagar Metro Station, Shivapuri Colony, L. B. Nagar, Hyderabad, Telangana",17.3497098,78.5457843
Jubilee Bus Stand,"Jubilee Bus Stand(JBS) Metro Rail Station, Gandhi Nagar, Nehru Nagar Colony, West Marredpally, Secunderabad, Telangana",17.4444274,78.4954444
Parade grounds,"Parade grounds metro staton, Sardar Patel Flyover, Gandhi Nagar, Regimental Bazaar, West Marredpally, Secunderabad, Telangana",17.44328,78.4965547
Secunderabad,"Secunderabad East Metro station, Regimental Bazaar, Shivaji Nagar, Secunderabad, Telangana",17.443279,78.4899886
Gandhi hospital,"Gandhi hospital metro station, Bhoiguda Road, M.I.G.H colony, PBR Estate, New Bhoiguda, Bhoiguda, Secunderabad, Telangana",17.4251169,78.4997311
Musheerabad,"Musheerabad Metro Station, Mumbai Highway, Musheerabad, Bakaram, Kavadiguda, Hyderabad, Telangana",17.4177753,78.4971552
RTC X Roads,"RTC X Roads Metro Station, Musheerabad Main Road, Musheerabad, Zamistanpur, Hyderabad, Telangana",17.4076213,78.4949149
Chikkadpally,"Chikkadpally, Chikkadpally, Himayatnagar, Hyderabad, Telangana",17.400775,78.4926903
Narayanaguda,"Narayanaguda Metro Station, Raja Bahadur Venkata Rama Reddy Road, Chitrapuri Colony, Bagh Lingampalli, Narayanguda, Hyderabad, Telangana",17.3953366,78.4882546
Sultan Bazar,"Sultan Bazar Metro Station, Turrebaz Khan Road, Esamiya Bazaar, Koti, Hyderabad, Telangana",17.3839712,78.4814673
Nagole,"Nagole metro station, Inner Ring Road, Surya Nagar, Saraswathi Colony, Ramanthapur, Hyderabad, Telangana",17.3907386,78.5566301
Uppal ,"Uppal Metro Station, Hyderabad - Warangal Highway, Venkateswara Colony, P & T Colony, Uppal, Hyderabad, Telangana",17.4013061,78.5585167
NGRI,"NGRI METRO STATION, Inner Ring Road, NGRI, Habsiguda, Hyderabad, Telangana",17.4145951,78.5444459
Habsiguda,"Habsiguda Metro Station, Habsiguda Main Road, near IICT, IICT Colony, Tarnaka, Hyderabad, Telangana",17.4201961,78.5383475
Tarnaka,"Tarnaka Metro Station, IRISET, Mettuguda, Secunderabad, Telangana",17.428293,78.526369
Mettuguda Metro Station,"Mettuguda Metro Station, Krishna Deva Raya Road, near St.Anthony Shrine, New Mettuguda, Lallaguda Railway Colony, Lalaguda, Mettuguda, Secunderabad, Telangana",17.4336002,78.5172134
Paradise,"Paradise Metro Station, Opp Fire Station, Paigah Colony, Hyderabad, Telangana",17.4435278,78.484
Rasoolpura,"Rasoolpura Metro Station, Gun Bazar, Rasoolpura, Hyderabad, Telangana",17.443597,78.4741763
Prakash Nagar,"Prakash Nagar Metro Station, Chikoti Gardens, Old Patigadda, Chikoti Gardens, Begumpet, Hyderabad, Telangana",17.4450826,78.4637424
Madhapur,"Madhapur Metro Station, Road Number 36, Aditya Enclave, Venkatagiri, Madhapur, Hyderabad, Telangana",17.4372435,78.398296
Durgam Cheruvu,"Durgam Cheruvu Metro Railway Station, CBI Colony, Jubilee Hills, Hyderabad, Telangana",17.4369566,78.3984428
Hitech City,"Hitech City Metro Station, Silicon Valley, Madhapur, Hyderabad, Telangana",17.448826,78.3810013
